{
  "$schema": "../schema/writing-skills.v1.schema.json",
  "count": 144,
  "format": "rhetorilex-writing-skills",
  "format_version": "1.0.0",
  "group_count": 11,
  "groups": [
    {
      "canonical_en": "/en/writing-skills/research-framing/",
      "count": 11,
      "description": "Shape a research problem from broad context to a bounded, defensible contribution.",
      "domain": "academic",
      "id": "research-framing",
      "name": "Research Framing"
    },
    {
      "canonical_en": "/en/writing-skills/literature-writing/",
      "count": 13,
      "description": "Represent, compare, and synthesise scholarship while keeping claims attached to their sources.",
      "domain": "academic",
      "id": "literature-writing",
      "name": "Literature Writing"
    },
    {
      "canonical_en": "/en/writing-skills/argumentation/",
      "count": 15,
      "description": "Build a traceable academic argument with calibrated claims, distinctions, concessions, and implications.",
      "domain": "academic",
      "id": "argumentation",
      "name": "Argumentation"
    },
    {
      "canonical_en": "/en/writing-skills/thesis-and-dissertation/",
      "count": 13,
      "description": "Coordinate long-form research chapters so each section performs a clear role in the whole argument.",
      "domain": "academic",
      "id": "thesis-and-dissertation",
      "name": "Thesis and Dissertation Writing"
    },
    {
      "canonical_en": "/en/writing-skills/publication-writing/",
      "count": 12,
      "description": "Adapt research content to publication genres, editorial exchanges, and transparency statements.",
      "domain": "academic",
      "id": "publication-writing",
      "name": "Publication Writing"
    },
    {
      "canonical_en": "/en/writing-skills/scientific-study-framing/",
      "count": 6,
      "description": "Connect a scientific question to prior evidence, testable expectations, and a bounded contribution.",
      "domain": "scientific",
      "id": "scientific-study-framing",
      "name": "Scientific Study Framing"
    },
    {
      "canonical_en": "/en/writing-skills/methods-writing/",
      "count": 19,
      "description": "Report how a study was designed, conducted, analysed, and governed with enough detail for appraisal.",
      "domain": "scientific",
      "id": "methods-writing",
      "name": "Methods Writing"
    },
    {
      "canonical_en": "/en/writing-skills/results-writing/",
      "count": 17,
      "description": "Report observations and estimates precisely before moving to interpretation.",
      "domain": "scientific",
      "id": "results-writing",
      "name": "Results Writing"
    },
    {
      "canonical_en": "/en/writing-skills/discussion-writing/",
      "count": 13,
      "description": "Interpret findings against design, uncertainty, prior literature, and plausible alternatives.",
      "domain": "scientific",
      "id": "discussion-writing",
      "name": "Discussion Writing"
    },
    {
      "canonical_en": "/en/writing-skills/scientific-claim-control/",
      "count": 11,
      "description": "Match scientific wording to design, evidence strength, uncertainty, and scope.",
      "domain": "scientific",
      "id": "scientific-claim-control",
      "name": "Scientific Claim Control"
    },
    {
      "canonical_en": "/en/writing-skills/paraphrasing/",
      "count": 14,
      "description": "Rewrite academic material by preserving meaning, attribution, quantities, and inferential force.",
      "domain": "paraphrasing",
      "id": "paraphrasing",
      "name": "Paraphrasing"
    }
  ],
  "language": "en",
  "provenance": {
    "author": "Reza Prama Arviandi",
    "method": "original_editorial",
    "restricted_source_used": false,
    "source_reuse": false
  },
  "release": "0.2.0",
  "skills": [
    {
      "canonical_en": "/en/writing-skills/research-framing/#establishing-a-research-context",
      "description": "Practical guidance to place the study within a bounded scholarly, social, or practical setting, with wording aligned to rhetorical purpose and available evidence.",
      "domain": "academic",
      "evidence_claim_warning": "Support field-level statements with relevant sources, and define any claimed gap by topic, population, setting, and search scope.",
      "example": "Research on urban heat has increasingly examined how neighbourhood design shapes exposure during extreme temperatures.",
      "group": "research-framing",
      "id": "writing.academic.research_framing.establishing_a_research_context",
      "name": "Establishing a research context",
      "related_phrase_functions": [
        "establish_context",
        "define_scope"
      ],
      "related_skill_ids": [
        "writing.academic.research_framing.introducing_a_topic"
      ],
      "rhetorical_objective": "Place the study within a bounded scholarly, social, or practical setting.",
      "slug": "establishing-a-research-context",
      "use_cases": [
        "introductions",
        "research proposals",
        "abstracts"
      ]
    },
    {
      "canonical_en": "/en/writing-skills/research-framing/#introducing-a-topic",
      "description": "Practical guidance to name the central subject and orient the reader without making an unsupported importance claim, with wording aligned to rhetorical purpose and available evidence.",
      "domain": "academic",
      "evidence_claim_warning": "Support field-level statements with relevant sources, and define any claimed gap by topic, population, setting, and search scope.",
      "example": "This article examines how community archives represent periods of forced migration.",
      "group": "research-framing",
      "id": "writing.academic.research_framing.introducing_a_topic",
      "name": "Introducing a topic",
      "related_phrase_functions": [
        "establish_context"
      ],
      "related_skill_ids": [
        "writing.academic.research_framing.establishing_a_research_context",
        "writing.academic.research_framing.establishing_significance"
      ],
      "rhetorical_objective": "Name the central subject and orient the reader without making an unsupported importance claim.",
      "slug": "introducing-a-topic",
      "use_cases": [
        "introductions",
        "research proposals",
        "abstracts"
      ]
    },
    {
      "canonical_en": "/en/writing-skills/research-framing/#establishing-significance",
      "description": "Practical guidance to explain why a problem, question, or setting deserves attention for a stated audience, with wording aligned to rhetorical purpose and available evidence.",
      "domain": "academic",
      "evidence_claim_warning": "Support field-level statements with relevant sources, and define any claimed gap by topic, population, setting, and search scope.",
      "example": "Reliable flood warnings matter because delayed alerts can narrow the time available for evacuation.",
      "group": "research-framing",
      "id": "writing.academic.research_framing.establishing_significance",
      "name": "Establishing significance",
      "related_phrase_functions": [
        "establish_context",
        "position_claim"
      ],
      "related_skill_ids": [
        "writing.academic.research_framing.introducing_a_topic",
        "writing.academic.research_framing.defining_a_research_problem"
      ],
      "rhetorical_objective": "Explain why a problem, question, or setting deserves attention for a stated audience.",
      "slug": "establishing-significance",
      "use_cases": [
        "introductions",
        "research proposals",
        "abstracts"
      ]
    },
    {
      "canonical_en": "/en/writing-skills/research-framing/#defining-a-research-problem",
      "description": "Practical guidance to turn a broad concern into a specific condition that research can investigate, with wording aligned to rhetorical purpose and available evidence.",
      "domain": "academic",
      "evidence_claim_warning": "Support field-level statements with relevant sources, and define any claimed gap by topic, population, setting, and search scope.",
      "example": "Existing battery tests do not capture performance loss under rapidly changing ambient temperatures.",
      "group": "research-framing",
      "id": "writing.academic.research_framing.defining_a_research_problem",
      "name": "Defining a research problem",
      "related_phrase_functions": [
        "establish_context",
        "identify_gap"
      ],
      "related_skill_ids": [
        "writing.academic.research_framing.establishing_significance",
        "writing.academic.research_framing.identifying_a_research_gap"
      ],
      "rhetorical_objective": "Turn a broad concern into a specific condition that research can investigate.",
      "slug": "defining-a-research-problem",
      "use_cases": [
        "introductions",
        "research proposals",
        "abstracts"
      ]
    },
    {
      "canonical_en": "/en/writing-skills/research-framing/#identifying-a-research-gap",
      "description": "Practical guidance to identify a bounded unanswered question rather than claiming that no research exists, with wording aligned to rhetorical purpose and available evidence.",
      "domain": "academic",
      "evidence_claim_warning": "Support field-level statements with relevant sources, and define any claimed gap by topic, population, setting, and search scope.",
      "example": "Although household energy use is well documented, its hour-by-hour response to heat alerts remains unclear.",
      "group": "research-framing",
      "id": "writing.academic.research_framing.identifying_a_research_gap",
      "name": "Identifying a research gap",
      "related_phrase_functions": [
        "identify_gap",
        "define_scope"
      ],
      "related_skill_ids": [
        "writing.academic.research_framing.defining_a_research_problem",
        "writing.academic.research_framing.stating_research_aims"
      ],